{
  "schema_version": "1.0.0",
  "source_checked_at": "2026-08-04",
  "description": "현재 legal_corpus.json에 존재하는 조문만을 근거로 작성한 법령용어-일상용어 지식베이스",
  "concepts": [
    {
      "concept_id": "pipa_collection_use",
      "legal_term": "개인정보의 수집·이용",
      "lay_terms": [
        "개인정보 받기",
        "고객정보 모으기",
        "정보 사용하기"
      ],
      "relation_type": "contextual_mapping",
      "scope_note": "개인정보 수집·이용의 법적 근거와 동의 요건",
      "law_id": "011357",
      "law_name": "개인정보 보호법",
      "article_refs": [
        "제15조"
      ],
      "effective_from": "2025-10-02",
      "effective_to": null,
      "source_document_ids": [
        "011357:제15조"
      ],
      "annotation_status": "reviewed",
      "annotation_note": "수집과 이용은 사안에 따라 각각의 처리 단계로 검토한다."
    },
    {
      "concept_id": "pipa_minimum_collection",
      "legal_term": "개인정보의 수집 제한",
      "lay_terms": [
        "필요한 만큼만 받기",
        "정보를 너무 많이 받기",
        "최소 수집"
      ],
      "relation_type": "contextual_mapping",
      "scope_note": "목적에 필요한 최소한의 개인정보 수집 원칙",
      "law_id": "011357",
      "law_name": "개인정보 보호법",
      "article_refs": [
        "제16조"
      ],
      "effective_from": "2025-10-02",
      "effective_to": null,
      "source_document_ids": [
        "011357:제16조:①"
      ],
      "annotation_status": "reviewed",
      "annotation_note": "최소 수집 여부는 구체적 처리 목적에 따라 달라진다."
    },
    {
      "concept_id": "pipa_third_party_provision",
      "legal_term": "개인정보의 제3자 제공",
      "lay_terms": [
        "다른 회사에 정보 넘기기",
        "외부 제공",
        "고객정보 공유"
      ],
      "relation_type": "contextual_mapping",
      "scope_note": "개인정보를 제3자에게 제공하는 법적 근거와 고지 사항",
      "law_id": "011357",
      "law_name": "개인정보 보호법",
      "article_refs": [
        "제17조"
      ],
      "effective_from": "2025-10-02",
      "effective_to": null,
      "source_document_ids": [
        "011357:제17조:①"
      ],
      "annotation_status": "reviewed",
      "annotation_note": "처리위탁과 제3자 제공은 동일한 개념이 아니다."
    },
    {
      "concept_id": "pipa_purpose_outside",
      "legal_term": "개인정보의 목적 외 이용·제공 제한",
      "lay_terms": [
        "처음 말한 목적과 다르게 쓰기",
        "다른 용도로 사용",
        "목적 외 사용"
      ],
      "relation_type": "contextual_mapping",
      "scope_note": "수집 목적 범위를 벗어난 이용 또는 제공의 제한",
      "law_id": "011357",
      "law_name": "개인정보 보호법",
      "article_refs": [
        "제18조"
      ],
      "effective_from": "2025-10-02",
      "effective_to": null,
      "source_document_ids": [
        "011357:제18조:①"
      ],
      "annotation_status": "reviewed",
      "annotation_note": "마케팅 이용은 수집 목적과 법적 근거를 별도로 확인한다."
    },
    {
      "concept_id": "pipa_destruction",
      "legal_term": "개인정보의 파기",
      "lay_terms": [
        "개인정보 삭제",
        "정보 폐기",
        "보유기간이 끝난 정보 없애기"
      ],
      "relation_type": "contextual_mapping",
      "scope_note": "보유기간 경과 또는 처리 목적 달성 후 개인정보 파기",
      "law_id": "011357",
      "law_name": "개인정보 보호법",
      "article_refs": [
        "제21조"
      ],
      "effective_from": "2025-10-02",
      "effective_to": null,
      "source_document_ids": [
        "011357:제21조:①"
      ],
      "annotation_status": "reviewed",
      "annotation_note": "삭제라는 일상어가 언제나 법정 파기 절차의 완료를 뜻하지는 않는다."
    },
    {
      "concept_id": "pipa_consent_method",
      "legal_term": "동의를 받는 방법",
      "lay_terms": [
        "동의서 받기",
        "필수 동의와 선택 동의",
        "동의 항목 표시"
      ],
      "relation_type": "contextual_mapping",
      "scope_note": "정보주체의 동의를 받을 때 구분·표시해야 하는 사항",
      "law_id": "011357",
      "law_name": "개인정보 보호법",
      "article_refs": [
        "제22조"
      ],
      "effective_from": "2025-10-02",
      "effective_to": null,
      "source_document_ids": [
        "011357:제22조:①"
      ],
      "annotation_status": "reviewed",
      "annotation_note": "동의가 모든 개인정보 처리를 정당화하는 포괄적 근거는 아니다."
    },
    {
      "concept_id": "pipa_child_consent",
      "legal_term": "아동의 개인정보 보호",
      "lay_terms": [
        "어린이 개인정보 동의",
        "아이 회원가입 동의",
        "법정대리인 동의"
      ],
      "relation_type": "contextual_mapping",
      "scope_note": "아동의 개인정보 처리에 필요한 동의",
      "law_id": "011357",
      "law_name": "개인정보 보호법",
      "article_refs": [
        "제22조의2"
      ],
      "effective_from": "2025-10-02",
      "effective_to": null,
      "source_document_ids": [
        "011357:제22조의2:①"
      ],
      "annotation_status": "reviewed",
      "annotation_note": "질문의 아동 연령과 현행 조문 기준을 함께 확인한다."
    },
    {
      "concept_id": "pipa_resident_number",
      "legal_term": "주민등록번호 처리의 제한",
      "lay_terms": [
        "주민번호 받기",
        "회원가입 때 주민번호 수집",
        "주민번호 사용"
      ],
      "relation_type": "contextual_mapping",
      "scope_note": "주민등록번호를 처리할 수 있는 법적 근거의 제한",
      "law_id": "011357",
      "law_name": "개인정보 보호법",
      "article_refs": [
        "제24조의2"
      ],
      "effective_from": "2025-10-02",
      "effective_to": null,
      "source_document_ids": [
        "011357:제24조의2:①"
      ],
      "annotation_status": "reviewed",
      "annotation_note": "편의 목적만으로 처리할 수 있는지를 구별한다."
    },
    {
      "concept_id": "pipa_processing_delegation",
      "legal_term": "업무위탁에 따른 개인정보 처리 제한",
      "lay_terms": [
        "개인정보 업무 외주",
        "개인정보 처리위탁",
        "외주업체에 고객정보 맡기기"
      ],
      "relation_type": "contextual_mapping",
      "scope_note": "처리업무 위탁 시 문서와 관리·감독 요건",
      "law_id": "011357",
      "law_name": "개인정보 보호법",
      "article_refs": [
        "제26조"
      ],
      "effective_from": "2025-10-02",
      "effective_to": null,
      "source_document_ids": [
        "011357:제26조:①"
      ],
      "annotation_status": "reviewed",
      "annotation_note": "제3자 제공과 구별하여 매핑한다."
    },
    {
      "concept_id": "pipa_privacy_policy",
      "legal_term": "개인정보 처리방침",
      "lay_terms": [
        "개인정보 안내문",
        "개인정보 정책",
        "처리방침 공개"
      ],
      "relation_type": "contextual_mapping",
      "scope_note": "처리방침에 포함하고 공개해야 하는 사항",
      "law_id": "011357",
      "law_name": "개인정보 보호법",
      "article_refs": [
        "제30조"
      ],
      "effective_from": "2025-10-02",
      "effective_to": null,
      "source_document_ids": [
        "011357:제30조:①"
      ],
      "annotation_status": "reviewed",
      "annotation_note": "개별 동의서와 처리방침은 역할이 다르다."
    },
    {
      "concept_id": "pipa_breach_notice",
      "legal_term": "개인정보 유출 등의 통지·신고",
      "lay_terms": [
        "개인정보가 새었을 때 알리기",
        "유출 신고",
        "정보 유출 통지"
      ],
      "relation_type": "contextual_mapping",
      "scope_note": "개인정보 유출 시 정보주체 통지와 기관 신고",
      "law_id": "011357",
      "law_name": "개인정보 보호법",
      "article_refs": [
        "제34조"
      ],
      "effective_from": "2025-10-02",
      "effective_to": null,
      "source_document_ids": [
        "011357:제34조:①"
      ],
      "annotation_status": "reviewed",
      "annotation_note": "통지와 신고의 상대방 및 세부 기한은 구분한다."
    },
    {
      "concept_id": "pipa_stop_processing",
      "legal_term": "개인정보의 처리정지",
      "lay_terms": [
        "내 정보 사용 중단",
        "개인정보 사용 그만하기",
        "처리 중지 요청"
      ],
      "relation_type": "contextual_mapping",
      "scope_note": "정보주체의 개인정보 처리정지 요구와 제한",
      "law_id": "011357",
      "law_name": "개인정보 보호법",
      "article_refs": [
        "제37조"
      ],
      "effective_from": "2025-10-02",
      "effective_to": null,
      "source_document_ids": [
        "011357:제37조:①"
      ],
      "annotation_status": "reviewed",
      "annotation_note": "삭제·파기 요구와 처리정지 요구를 동일시하지 않는다."
    },
    {
      "concept_id": "pipa_damages",
      "legal_term": "개인정보 침해 손해배상책임",
      "lay_terms": [
        "개인정보 피해 보상",
        "정보 유출 손해배상",
        "개인정보 위반 배상"
      ],
      "relation_type": "contextual_mapping",
      "scope_note": "법 위반으로 발생한 손해의 배상책임",
      "law_id": "011357",
      "law_name": "개인정보 보호법",
      "article_refs": [
        "제39조"
      ],
      "effective_from": "2025-10-02",
      "effective_to": null,
      "source_document_ids": [
        "011357:제39조:①"
      ],
      "annotation_status": "reviewed",
      "annotation_note": "구체적 책임 성립과 배상액은 사실관계 검토가 필요하다."
    },
    {
      "concept_id": "pipa_sensitive_biometrics",
      "legal_term": "민감정보인 생체인식정보",
      "lay_terms": [
        "지문 정보",
        "홍채 정보",
        "얼굴인식 정보"
      ],
      "relation_type": "narrower_term",
      "scope_note": "개인 식별 목적으로 처리되는 생체정보의 민감정보 해당 범위",
      "law_id": "011468",
      "law_name": "개인정보 보호법 시행령",
      "article_refs": [
        "제18조"
      ],
      "effective_from": "2026-05-19",
      "effective_to": null,
      "source_document_ids": [
        "011468:제18조:제1항"
      ],
      "annotation_status": "reviewed",
      "annotation_note": "모든 생체정보가 동일하게 해당한다고 단정하지 않는다."
    },
    {
      "concept_id": "pipa_breach_report_deadline",
      "legal_term": "개인정보 유출 신고기한",
      "lay_terms": [
        "유출 72시간 신고",
        "정보 유출 신고 시한",
        "개인정보 사고 신고기한"
      ],
      "relation_type": "contextual_mapping",
      "scope_note": "개인정보 유출 신고의 세부 기준과 시간 요건",
      "law_id": "011468",
      "law_name": "개인정보 보호법 시행령",
      "article_refs": [
        "제40조"
      ],
      "effective_from": "2026-05-19",
      "effective_to": null,
      "source_document_ids": [
        "011468:제40조:①"
      ],
      "annotation_status": "reviewed",
      "annotation_note": "법률상 의무와 시행령상 세부 기준을 함께 검토한다."
    },
    {
      "concept_id": "eft_access_media",
      "legal_term": "접근매체의 선정·사용 및 관리",
      "lay_terms": [
        "통장 빌려주기",
        "카드 대여",
        "비밀번호 넘기기"
      ],
      "relation_type": "contextual_mapping",
      "scope_note": "전자금융 접근매체의 양도·대여 등 제한",
      "law_id": "010199",
      "law_name": "전자금융거래법",
      "article_refs": [
        "제6조"
      ],
      "effective_from": "2025-12-16",
      "effective_to": null,
      "source_document_ids": [
        "010199:제6조:①"
      ],
      "annotation_status": "reviewed",
      "annotation_note": "접근매체 유형과 구체적인 행위 태양을 확인한다."
    },
    {
      "concept_id": "eft_provider_liability",
      "legal_term": "금융회사 또는 전자금융업자의 책임",